lifecycle_state,semantic_meaning,entry_conditions,allowed_operations,forbidden_operations,outgoing_transitions,localization_requirement,validation_requirement,mutability,snapshot_presence,journal_visibility
DRAFT,Activated document under predmetnaya preparation; baseline mutable,Document activated; lifecycle_state=DRAFT,semantic_edit;editorial_edit;locale_edit;regeneration;attachment_edit;validation;mark_ready;cancel;archive_if_policy,sign;register;annul;silent_regeneration_post_ready,DRAFT→READY_FOR_SIGNATURE;DRAFT→VOIDED(CANCEL),mandatory locales may be CURRENT or STALE; STALE blocks READY,E* clearance attached; L-series on transition commands,fully_editable,baseline_v1_mutable,visible_default
READY_FOR_SIGNATURE,Editorial complete; mandatory locales ready; blocking validations passed; prepared for signing,mark_ready succeeded,limited_metadata;view;print_preview;return_to_draft;sign;cancel;archive_if_policy,semantic_edit;editorial_edit;locale_content_edit;regeneration;item_edit;attachment_edit,READY→DRAFT;READY→SIGNED;READY→VOIDED(CANCEL),all mandatory locales CURRENT; REVIEW_REQUIRED blocks without waiver,L* at sign/return; E* re-check on return,content_read_only;metadata_conditional,pre_sign_baseline_frozen_copy_pending,visible_default
SIGNED,Legally significant boundary; immutable signed snapshot created,sign_document succeeded,view;print;register;annul;archive_if_policy,content_edit;regeneration;locale_edit;cancel,SIGNED→REGISTERED;SIGNED→VOIDED(ANNUL),locale representations frozen in signed snapshot,L* registration gates,immutable_content;registration_fields_pending,signed_immutable_snapshot,visible_default
REGISTERED,Officially registered document; registration number assigned,register_document succeeded,view;print;annul;archive;execution_projection_if_policy,content_edit;cancel;lifecycle_restore,REGISTERED→VOIDED(ANNUL),frozen per signed snapshot,L* annul gates; specialization projection gates,immutable_content;registration_immutable,signed_immutable_snapshot;registration_metadata,visible_default;journal_official
VOIDED,Terminal lifecycle; document voided with void_kind and reason,void command succeeded,view;print;audit;archive,any_mutation;lifecycle_restore;cancel;annul_repeat,none_terminal,irrelevant frozen,none,immutable_all,signed_snapshot_if_existed;void_metadata,visible_per_policy;closed_journal_option
ARCHIVED_orthogonal,Orthogonal archive flag; not lifecycle status,archive_document succeeded on eligible lifecycle state,view;print;audit;restore,any_mutation;lifecycle_transition,restore→prior_lifecycle_state_unchanged,unchanged from pre-archive,unchanged,immutable_all_operations_blocked,prior_snapshots_unchanged,hidden_from_default_journal_optional
